{
  "completeness_score": 100,
  "conflicting_claims": [],
  "duplicate_artifacts": [],
  "evidence_inventory": [
    {
      "id": "wizards-mb2-product-page-title",
      "integrity_verified": true,
      "media_type": "text/html",
      "path": "artifacts/wizards-mb2-product-page-title-20260729.html",
      "source_ids": [
        "wizards-mystery-booster-2-product-overview"
      ]
    }
  ],
  "handoff_id": "phase_67_mb2_evidence_20260730",
  "missing_evidence": [],
  "orphaned_artifacts": [],
  "provenance_summary": {
    "declared_source_count": 1,
    "referenced_source_ids": [
      "wizards-mystery-booster-2-product-overview"
    ]
  },
  "recommendation": "Ready for verification",
  "schema_version": "v1",
  "supported_claims": [
    "mb2.product.identity.title"
  ],
  "unsupported_claims": [],
  "validation_findings": []
}
